ARXIVID,Title,Abstract,Authors,Affiliations,Date_published,URL
2506.00821v1,SafeGenes: Evaluating the Adversarial Robustness of Genomic Foundation   Models,"Genomic Foundation Models (GFMs), such as Evolutionary Scale Modeling (ESM), have demonstrated significant success in variant effect prediction. However, their adversarial robustness remains largely unexplored. To address this gap, we propose SafeGenes: a framework for Secure analysis of genomic foundation models, leveraging adversarial attacks to evaluate robustness against both engineered near-identical adversarial Genes and embedding-space manipulations. In this study, we assess the adversarial vulnerabilities of GFMs using two approaches: the Fast Gradient Sign Method (FGSM) and a soft prompt attack. FGSM introduces minimal perturbations to input sequences, while the soft prompt attack optimizes continuous embeddings to manipulate model predictions without modifying the input tokens. By combining these techniques, SafeGenes provides a comprehensive assessment of GFM susceptibility to adversarial manipulation. Targeted soft prompt attacks led to substantial performance degradation, even in large models such as ESM1b and ESM1v. These findings expose critical vulnerabilities in current foundation models, opening new research directions toward improving their security and robustness in high-stakes genomic applications such as variant effect prediction.",Huixin Zhan; Jason H. Moore,,2025-06-01T03:54:03Z,http://arxiv.org/abs/2506.00821v1
2506.12986v1,Improving spliced alignment by modeling splice sites with deep learning,"Motivation: Spliced alignment refers to the alignment of messenger RNA (mRNA) or protein sequences to eukaryotic genomes. It plays a critical role in gene annotation and the study of gene functions. Accurate spliced alignment demands sophisticated modeling of splice sites, but current aligners use simple models, which may affect their accuracy given dissimilar sequences.   Results: We implemented minisplice to learn splice signals with a one-dimensional convolutional neural network (1D-CNN) and trained a model with 7,026 parameters for vertebrate and insect genomes. It captures conserved splice signals across phyla and reveals GC-rich introns specific to mammals and birds. We used this model to estimate the empirical splicing probability for every GT and AG in genomes, and modified minimap2 and miniprot to leverage pre-computed splicing probability during alignment. Evaluation on human long-read RNA-seq data and cross-species protein datasets showed our method greatly improves the junction accuracy especially for noisy long RNA-seq reads and proteins of distant homology.   Availability and implementation: https://github.com/lh3/minisplice",Siying Yang; Neng Huang; Heng Li,,2025-06-15T22:57:33Z,http://arxiv.org/abs/2506.12986v1
2507.04111v1,Quantum computing for genomics: conceptual challenges and practical   perspectives,"We assess the potential of quantum computing to accelerate computation of central tasks in genomics, focusing on often-neglected theoretical limitations. We discuss state-of-the-art challenges of quantum search, optimization, and machine learning algorithms. Examining database search with Grover's algorithm, we show that the expected speedup vanishes under realistic assumptions. For combinatorial optimization prevalent in genomics, we discuss the limitations of theoretical complexity in practice and suggest carefully identifying problems genuinely suited for quantum acceleration. Given the competition from excellent classical approximate solvers, quantum computing could offer a speedup in the near future only for a specific subset of hard enough tasks in assembly, gene selection, and inference. These tasks need to be characterized by core optimization problems that are particularly challenging for classical methods while requiring relatively limited variables. We emphasize rigorous empirical validation through runtime scaling analysis to avoid misleading claims of quantum advantage. Finally, we discuss the problem of trainability and data-loading in quantum machine learning. This work advocates for a balanced perspective on quantum computing in genomics, guiding future research toward targeted applications and robust validation.",Aurora Maurizio; Guglielmo Mazzola,,2025-07-05T17:41:10Z,http://arxiv.org/abs/2507.04111v1
2508.02061v1,A Bayesian approach to model uncertainty in single-cell genomic data,"Network models provide a powerful framework for analysing single-cell count data, facilitating the characterisation of cellular identities, disease mechanisms, and developmental trajectories. However, uncertainty modeling in unsupervised learning with genomic data remains insufficiently explored. Conventional clustering methods assign a singular identity to each cell, potentially obscuring transitional states during differentiation or mutation. This study introduces a variational Bayesian framework for clustering and analysing single-cell genomic data, employing a Bayesian Gaussian mixture model to estimate the probabilistic association of cells with distinct clusters. This approach captures cellular transitions, yielding biologically coherent insights into neurogenesis and breast cancer progression. The inferred clustering probabilities enable further analyses, including Differential Expression Analysis and pseudotime analysis. Furthermore, we propose utilising the misclustering rate and Area Under the Curve in clustering scRNA-seq data as an innovative metric to quantitatively evaluate overall clustering performance. This methodological advancement enhances the resolution of single-cell data analysis, enabling a more nuanced characterisation of dynamic cellular identities in development and disease.",Shanshan Ren; Thomas E. Bartlett; Lina Gerontogianni; Swati Chandna,,2025-08-04T05:00:15Z,http://arxiv.org/abs/2508.02061v1
2508.07127v1,How Effectively Can Large Language Models Connect SNP Variants and ECG   Phenotypes for Cardiovascular Risk Prediction?,"Cardiovascular disease (CVD) prediction remains a tremendous challenge due to its multifactorial etiology and global burden of morbidity and mortality. Despite the growing availability of genomic and electrophysiological data, extracting biologically meaningful insights from such high-dimensional, noisy, and sparsely annotated datasets remains a non-trivial task. Recently, LLMs has been applied effectively to predict structural variations in biological sequences. In this work, we explore the potential of fine-tuned LLMs to predict cardiac diseases and SNPs potentially leading to CVD risk using genetic markers derived from high-throughput genomic profiling. We investigate the effect of genetic patterns associated with cardiac conditions and evaluate how LLMs can learn latent biological relationships from structured and semi-structured genomic data obtained by mapping genetic aspects that are inherited from the family tree. By framing the problem as a Chain of Thought (CoT) reasoning task, the models are prompted to generate disease labels and articulate informed clinical deductions across diverse patient profiles and phenotypes. The findings highlight the promise of LLMs in contributing to early detection, risk assessment, and ultimately, the advancement of personalized medicine in cardiac care.",Niranjana Arun Menon; Iqra Farooq; Yulong Li; Sara Ahmed; Yutong Xie; Muhammad Awais; Imran Razzak,,2025-08-10T00:19:29Z,http://arxiv.org/abs/2508.07127v1
2508.21806v1,Suppression of errors in collectively coded information,"Modern life largely transmits genetic information from mother to daughter through the duplication of single physically intact molecules that encode information. However, copying an extended molecule requires highly processive copying machinery and high fidelity that scales with the genome size to avoid the error catastrophe. Here, we explore these fidelity requirements in an alternative architecture, the virtual circular genome, in which no one physical molecule encodes the full genetic information. Instead, information is encoded and transmitted in a collective of overlapping and interacting segments. Using a model experimental system of a complex mixture of DNA oligos that can partly anneal and extend off each other, we find that mutant oligomers are suppressed relative to a model without collective encoding. Through simulations and theory, we show that this suppression of mutants can be explained by competition for productive binding partners. As a consequence, information can be propagated robustly in a virtual circular genome even if the mutation rate is above the error catastrophe for a physically intact genome.",Martin J. Falk; Leon Zhou; Yoshiya J. Matsubara; Kabir Husain; Jack W. Szostak; Arvind Murugan,,2025-08-29T17:39:29Z,http://arxiv.org/abs/2508.21806v1
2503.20964v2,Active Hydrodynamic Theory of Euchromatin and Heterochromatin,"The genome contains genetic information essential for cell's life. The genome's spatial organization inside the cell nucleus is critical for its proper function including gene regulation. The two major genomic compartments -- euchromatin and heterochromatin -- contain largely transcriptionally active and silenced genes, respectively, and exhibit distinct dynamics. In this work, we present a hydrodynamic framework that describes the large-scale behavior of euchromatin and heterochromatin, and accounts for the interplay of mechanical forces, active processes, and nuclear confinement. Our model shows contractile stresses from cross-linking proteins lead to the formation of heterochromatin droplets via mechanically driven phase separation. These droplets grow, coalesce, and in nuclear confinement, wet the boundary. Active processes, such as gene transcription in euchromatin, introduce non-equilibrium fluctuations that drive long-range, coherent motions of chromatin as well as the nucleoplasm, and thus alter the genome's spatial organization. These fluctuations also indirectly deform heterochromatin droplets, by continuously changing their shape. Taken together, our findings reveal how active forces, mechanical stresses and hydrodynamic flows contribute to the genome's organization at large scales and provide a physical framework for understanding chromatin organization and dynamics in live cells.",S. Alex Rautu; Alexandra Zidovska; David Saintillan; Michael J. Shelley,,2025-03-26T20:07:13Z,http://arxiv.org/abs/2503.20964v2
2504.15934v1,Real-time raw signal genomic analysis using fully integrated memristor   hardware,"Advances in third-generation sequencing have enabled portable and real-time genomic sequencing, but real-time data processing remains a bottleneck, hampering on-site genomic analysis due to prohibitive time and energy costs. These technologies generate a massive amount of noisy analog signals that traditionally require basecalling and digital mapping, both demanding frequent and costly data movement on von Neumann hardware. To overcome these challenges, we present a memristor-based hardware-software co-design that processes raw sequencer signals directly in analog memory, effectively combining the separated basecalling and read mapping steps. Here we demonstrate, for the first time, end-to-end memristor-based genomic analysis in a fully integrated memristor chip. By exploiting intrinsic device noise for locality-sensitive hashing and implementing parallel approximate searches in content-addressable memory, we experimentally showcase on-site applications including infectious disease detection and metagenomic classification. Our experimentally-validated analysis confirms the effectiveness of this approach on real-world tasks, achieving a state-of-the-art 97.15% F1 score in virus raw signal mapping, with 51x speed up and 477x energy saving compared to implementation on a state-of-the-art ASIC. These results demonstrate that memristor-based in-memory computing provides a viable solution for integration with portable sequencers, enabling truly real-time on-site genomic analysis for applications ranging from pathogen surveillance to microbial community profiling.",Peiyi He; Shengbo Wang; Ruibin Mao; Sebastian Siegel; Giacomo Pedretti; Jim Ignowski; John Paul Strachan; Ruibang Luo; Can Li,,2025-04-22T14:22:34Z,http://arxiv.org/abs/2504.15934v1
2504.20328v1,Mantodea phylogenomics provides new insights into X-chromosome   progression and evolutionary radiation,"Background: Praying mantises, members of the order Mantodea, play important roles in agriculture, medicine, bionics, and entertainment. However, the scarcity of genomic resources has hindered extensive studies on mantis evolution and behaviour. Results: Here, we present the chromosome-scale reference genomes of five mantis species: the European mantis (Mantis religiosa), Chinese mantis (Tenodera sinensis), triangle dead leaf mantis (Deroplatys truncata), orchid mantis (Hymenopus coronatus), and metallic mantis (Metallyticus violaceus). We found that transposable element expansion is the major force governing genome size in Mantodea. Based on whole-alignments, we deduced that the Mantodea ancestor may have had only one X chromosome and that translocations between the X chromosome and an autosome may have occurred in the lineage of the superfamily Mantoidea. Furthermore, we found a lower evolutionary rate for the metallic mantis than for the other mantises. We also found that Mantodea underwent rapid radiation after the K-Pg mass extinction event, which could have contributed to the confusion in species classification. Conclusions: We present the chromosome-scale reference genomes of five mantis species to reveal the X-chromosome evolution, clarify the phylogeny relationship, and transposable element expansion.",Hangwei Liu; Lihong Lei; Fan Jiang; Bo Zhang; Hengchao Wang; Yutong Zhang; Anqi Wang; Hanbo Zhao; Guirong Wang; Wei Fan,,2025-04-29T00:36:14Z,http://arxiv.org/abs/2504.20328v1
2505.10017v1,Data mining of public genomic repositories: harnessing off-target reads   to expand microbial pathogen genomic resources,"As sequencing technologies become more affordable and genomic databases expand continuously, the reuse of publicly available sequencing data emerges as a powerful strategy for studying microbial pathogens. Indeed, raw sequencing reads generated for the study of a given organism often contain reads originating from the associated microbiota. This review explores how such off-target reads can be detected and used for the study of microbial pathogens. We present genomic data mining as a method to identify relevant sequencing runs from petabase-scale databases, highlighting recent methodological advances that allow efficient database querying. We then briefly outline methods designed to retrieve relevant data and associated metadata, and provide an overview of common downstream analysis pipelines. We discuss how such approaches have (i) expanded the known genetic diversity of microbial pathogens, (ii) enriched our understanding of their spatiotemporal distribution, and (iii) highlighted previously unrecognized ecological interactions involving microbial pathogens. However, these analyses often rely on the completeness and accuracy of accompanying metadata, which remain highly variable. We detail common pitfalls, including data contamination and metadata misannotations, and suggest strategies for result interpretation. Ultimately, while data mining cannot replace dedicated studies, it constitutes an essential and complementary tool for microbial pathogen research. Broader utility will depend on improved data standardization and systematic genomic monitoring across ecosystems.",Damien Richard; Nils Poulicard,UMR PHIM; UMR PHIM,2025-05-15T06:59:18Z,http://arxiv.org/abs/2505.10017v1
2507.07761v1,Widespread remote introgression in the grass genomes,"Genetic transfers are pervasive across both prokaryotes and eukaryotes, encompassing canonical genomic introgression between species or genera and horizontal gene transfer (HGT) across kingdoms. However, DNA transfer between phylogenetically distant species, here defined as remote introgression (RI), has remained poorly explored in evolutionary genomics. In this study, we present RIFinder, a novel phylogeny-based method for RI event detection, and apply it to a comprehensive dataset of 122 grass genomes. Our analysis identifies 622 RI events originating from 543 distinct homologous genes, revealing distinct characteristics among grass subfamilies. Specifically, the subfamily Pooideae exhibits the highest number of introgressed genes while Bambusoideae contains the lowest. Comparisons among accepted genes, their donor copies and native homologs demonstrate that introgressed genes undergo post-transfer localized adaptation, with significant functional enrichment in stress-response pathways. Notably, we identify a large Triticeae-derived segment in a Chloridoideae species Cleistogenes songorica, which is potentially associated with its exceptional drought tolerance. Furthermore, we provide compelling evidence that RI has contributed to the origin and diversification of biosynthetic gene clusters of gramine, a defensive alkaloid chemical, across grass species. Collectively, our study establishes a robust method for RI detection and highlights its critical role in adaptive evolution.",Yujie Huang; Shiyu Zhang; Hanyang Lin; Chenxu Liu; Zhefu Li; Kun Yang; Yutong Liu; Linfeng Jin; Chuanlong Lu; Yuan Cheng; Chaoyi Hu; Huifang Zhao; Guoping Zhang; Qian Qian; Longjiang Fan; Dongya Wu,,2025-07-10T13:37:42Z,http://arxiv.org/abs/2507.07761v1
2507.08542v1,CircFormerMoE: An End-to-End Deep Learning Framework for Circular RNA   Splice Site Detection and Pairing in Plant Genomes,"Circular RNAs (circRNAs) are important components of the non-coding RNA regulatory network. Previous circRNA identification primarily relies on high-throughput RNA sequencing (RNA-seq) data combined with alignment-based algorithms that detect back-splicing signals. However, these methods face several limitations: they can't predict circRNAs directly from genomic DNA sequences and relies heavily on RNA experimental data; they involve high computational costs due to complex alignment and filtering steps; and they are inefficient for large-scale or genome-wide circRNA prediction. The challenge is even greater in plants, where plant circRNA splice sites often lack the canonical GT-AG motif seen in human mRNA splicing, and no efficient deep learning model with strong generalization capability currently exists. Furthermore, the number of currently identified plant circRNAs is likely far lower than their true abundance. In this paper, we propose a deep learning framework named CircFormerMoE based on transformers and mixture-of experts for predicting circRNAs directly from plant genomic DNA. Our framework consists of two subtasks known as splicing site detection (SSD) and splicing site pairing (SSP). The model's effectiveness has been validated on gene data of 10 plant species. Trained on known circRNA instances, it is also capable of discovering previously unannotated circRNAs. In addition, we performed interpretability analyses on the trained model to investigate the sequence patterns contributing to its predictions. Our framework provides a fast and accurate computational method and tool for large-scale circRNA discovery in plants, laying a foundation for future research in plant functional genomics and non-coding RNA annotation.",Tianyou Jiang,,2025-07-11T12:43:17Z,http://arxiv.org/abs/2507.08542v1
2509.01020v1,"GeneTEK: Low-power, high-performance and scalable genome sequence   matching in FPGAs","The advent of next-generation sequencing (NGS) has revolutionized genomic research by enabling high-throughput data generation through parallel sequencing of a diverse range of organisms at significantly reduced costs. This breakthrough has unleashed a ""Cambrian explosion"" in genomic data volume and diversity. This volume of workloads places genomics among the top four big data challenges anticipated for this decade. In this context, pairwise sequence alignment represents a very time- and energy-consuming step in common bioinformatics pipelines. Speeding up this step requires the implementation of heuristic approaches, optimized algorithms, and/or hardware acceleration.   Whereas state-of-the-art CPU and GPU implementations have demonstrated significant performance gains, recent field programmable gate array (FPGA) implementations have shown improved energy efficiency. However, the latter often suffer from limited scalability due to constraints on hardware resources when aligning longer sequences. In this work, we present a scalable and flexible FPGA-based accelerator template that implements Myers's algorithm using high-level synthesis and a worker-based architecture. GeneTEK, an instance of this accelerator template in a Xilinx Zynq UltraScale+ FPGA, outperforms state-of-the-art CPU and GPU implementations in both speed and energy efficiency, while overcoming scalability limitations of current FPGA approaches. Specifically, GeneTEK achieves at least a 19.4% increase in execution speed and up to 62x reduction in energy consumption compared to leading CPU and GPU solutions, while fitting comparison matrices up to 72% larger compared to previous FPGA solutions. These results reaffirm the potential of FPGAs as an energy-efficient platform for scalable genomic workloads.",Elena Espinosa; Rubén Rodríguez Álvarez; José Miranda; Rafael Larrosa; Miguel Peón-Quirós; Oscar Plata; David Atienza,,2025-08-31T23:11:48Z,http://arxiv.org/abs/2509.01020v1
2501.04822v1,Curated loci prime editing (cliPE) for accessible multiplexed assays of   variant effect (MAVEs),"Multiplexed assays of variant effect (MAVEs) perform simultaneous characterization of many variants. Prime editing has been recently adopted for introducing many variants in their native genomic contexts. However, robust protocols and standards are limited, preventing widespread uptake. Herein, we describe curated loci prime editing (cliPE) which is an accessible, low-cost experimental pipeline to perform MAVEs using prime editing of a target gene, as well as a companion Shiny app (pegRNA Designer) to rapidly and easily design user-specific MAVE libraries.",Carina G Biar; Nicholas Bodkin; Gemma L Carvill; Jeffrey D Calhoun,,2025-01-08T20:21:40Z,http://arxiv.org/abs/2501.04822v1
2503.04490v2,Large Language Models in Bioinformatics: A Survey,"Large Language Models (LLMs) are revolutionizing bioinformatics, enabling advanced analysis of DNA, RNA, proteins, and single-cell data. This survey provides a systematic review of recent advancements, focusing on genomic sequence modeling, RNA structure prediction, protein function inference, and single-cell transcriptomics. Meanwhile, we also discuss several key challenges, including data scarcity, computational complexity, and cross-omics integration, and explore future directions such as multimodal learning, hybrid AI models, and clinical applications. By offering a comprehensive perspective, this paper underscores the transformative potential of LLMs in driving innovations in bioinformatics and precision medicine.",Zhenyu Wang; Zikang Wang; Jiyue Jiang; Pengan Chen; Xiangyu Shi; Yu Li,,2025-03-06T14:38:20Z,http://arxiv.org/abs/2503.04490v2
2505.07740v1,Pan-genome Analysis of Plastomes from Lamiales using PGR-TK,"Chloroplast sequences from the Lamiales order were analyzed using the Pangenome Research Toolkit (PGR-TK). Overall, most genera and families exhibited a high degree of sequence uniformity. However, at the genus level, Utricularia, Incarvillea, and Orobanche stood out as particularly divergent. At the family level, Orobanchaceae, Bignoniaceae and Lentibulariaceae displayed notably complex patterns in the generated plots. The PGR-TK algorithm successfully distinguished most genera within their respective families and often recognized misclassified plants.",Aadhavan Veerendra; Manoj Samanta,,2025-05-12T16:49:38Z,http://arxiv.org/abs/2505.07740v1
2505.11610v1,Foundation Models for AI-Enabled Biological Design,"This paper surveys foundation models for AI-enabled biological design, focusing on recent developments in applying large-scale, self-supervised models to tasks such as protein engineering, small molecule design, and genomic sequence design. Though this domain is evolving rapidly, this survey presents and discusses a taxonomy of current models and methods. The focus is on challenges and solutions in adapting these models for biological applications, including biological sequence modeling architectures, controllability in generation, and multi-modal integration. The survey concludes with a discussion of open problems and future directions, offering concrete next-steps to improve the quality of biological sequence generation.",Asher Moldwin; Amarda Shehu,,2025-05-16T18:17:37Z,http://arxiv.org/abs/2505.11610v1
2508.10058v1,A Structural Analysis of Population Graphs,"The format of graphing algorithms for genomic data has been a debate in recent biotechnology. In this paper, we discuss the construction of population graphs using said genomic data. We first examine the GENPOFAD distance measurement, developed by Joly et. al., and prove that this constitutes a metric function. We develop an algorithm to construct graphs to visualize the relationships between individuals in a population. We then provide a statistical analysis of these simulated population graphs, and show that they are distinct from randomly generated graphs, and also show differences from small-world graphs.",Kimberly Ayers; Maxwell Kooiker,,2025-08-12T21:51:08Z,http://arxiv.org/abs/2508.10058v1
