ARXIVID,Title,Abstract,Authors,Affiliations,Date_published,URL
2503.09496v2,Robust Multimodal Survival Prediction with the Latent Differentiation   Conditional Variational AutoEncoder,"The integrative analysis of histopathological images and genomic data has received increasing attention for survival prediction of human cancers. However, the existing studies always hold the assumption that full modalities are available. As a matter of fact, the cost for collecting genomic data is high, which sometimes makes genomic data unavailable in testing samples. A common way of tackling such incompleteness is to generate the genomic representations from the pathology images. Nevertheless, such strategy still faces the following two challenges: (1) The gigapixel whole slide images (WSIs) are huge and thus hard for representation. (2) It is difficult to generate the genomic embeddings with diverse function categories in a unified generative framework. To address the above challenges, we propose a Conditional Latent Differentiation Variational AutoEncoder (LD-CVAE) for robust multimodal survival prediction, even with missing genomic data. Specifically, a Variational Information Bottleneck Transformer (VIB-Trans) module is proposed to learn compressed pathological representations from the gigapixel WSIs. To generate different functional genomic features, we develop a novel Latent Differentiation Variational AutoEncoder (LD-VAE) to learn the common and specific posteriors for the genomic embeddings with diverse functions. Finally, we use the product-of-experts technique to integrate the genomic common posterior and image posterior for the joint latent distribution estimation in LD-CVAE. We test the effectiveness of our method on five different cancer datasets, and the experimental results demonstrate its superiority in both complete and missing modality scenarios.",Junjie Zhou; Jiao Tang; Yingli Zuo; Peng Wan; Daoqiang Zhang; Wei Shao,,2025-03-12T15:58:37Z,http://arxiv.org/abs/2503.09496v2
2504.03732v2,SAGe: A Lightweight Algorithm-Architecture Co-Design for Mitigating the   Data Preparation Bottleneck in Large-Scale Genome Analysis,"Given the exponentially growing volumes of genomic data, there are extensive efforts to accelerate genome analysis. We demonstrate a major bottleneck that greatly limits and diminishes the benefits of state-of-the-art genome analysis accelerators: the data preparation bottleneck, where genomic data is stored in compressed form and needs to be decompressed and formatted first before an accelerator can operate on it. To mitigate this bottleneck, we propose SAGe, an algorithm-architecture co-design for highly-compressed storage and high-performance access of large-scale genomic data. SAGe overcomes the challenges of mitigating the data preparation bottleneck while maintaining high compression ratios (comparable to genomic-specific compression algorithms) at low hardware cost. This is enabled by leveraging key features of genomic datasets to co-design (i) a new (de)compression algorithm, (ii) hardware, (iii) storage data layout, and (iv) interface commands to access storage. SAGe stores data in structures that can be rapidly interpreted and decompressed by efficient streaming accesses and lightweight hardware. To achieve high compression ratios using only these lightweight structures, SAGe exploits unique features of genomic data. We show that SAGe can be seamlessly integrated with a broad range of genome analysis hardware accelerators to mitigate their data preparation bottlenecks. Our results demonstrate that SAGe improves the average end-to-end performance and energy efficiency of two state-of-the-art genome analysis accelerators by 3.0x-32.1x and 18.8x-49.6x, respectively, compared to when the accelerators rely on state-of-the-art decompression tools.",Nika Mansouri Ghiasi; Talu Güloglu; Harun Mustafa; Can Firtina; Konstantina Koliogeorgi; Konstantinos Kanellopoulos; Haiyu Mao; Rakesh Nadig; Mohammad Sadrosadati; Jisung Park; Onur Mutlu,,2025-03-31T23:36:26Z,http://arxiv.org/abs/2504.03732v2
2507.08060v1,MicroTrace: A Lightweight R Tool for SNP-Based Pathogen Clustering in   Outbreak Detection,"MicroTrace is an open-source R tool that performs SNP-based hierarchical clustering to detect potential transmission clusters from pathogen whole-genome sequencing (WGS) data. Designed for epidemiologists, microbiologists, and genomic surveillance teams, it processes SNP distance matrices and outputs dendrograms and cluster tables with optional metadata integration. MicroTrace enables reproducible outbreak detection workflows with minimal setup.",Kaitao Lai,,2025-07-10T15:41:53Z,http://arxiv.org/abs/2507.08060v1
2506.17766v1,Improving Genomic Models via Task-Specific Self-Pretraining,"Pretraining DNA language models (DNALMs) on the full human genome is resource-intensive, yet often considered necessary for strong downstream performance. Inspired by recent findings in NLP and long-context modeling, we explore an alternative: self-pretraining on task-specific, unlabeled data. Using the BEND benchmark, we show that DNALMs trained with self-pretraining match or exceed the performance of models trained from scratch under identical compute. While genome-scale pretraining may still offer higher absolute performance, task-specific self-pretraining provides a practical and compute-efficient strategy for building stronger supervised baselines.",Sohan Mupparapu; Parameswari Krishnamurthy; Ratish Puduppully,,2025-06-21T17:19:21Z,http://arxiv.org/abs/2506.17766v1
2501.16982v1,"Human Genome Book: Words, Sentences and Paragraphs","Since the completion of the human genome sequencing project in 2001, significant progress has been made in areas such as gene regulation editing and protein structure prediction. However, given the vast amount of genomic data, the segments that can be fully annotated and understood remain relatively limited. If we consider the genome as a book, constructing its equivalents of words, sentences, and paragraphs has been a long-standing and popular research direction. Recently, studies on transfer learning in large language models have provided a novel approach to this challenge.Multilingual transfer ability, which assesses how well models fine-tuned on a source language can be applied to other languages, has been extensively studied in multilingual pre-trained models. Similarly, the transfer of natural language capabilities to ""DNA language"" has also been validated. Building upon these findings, we first trained a foundational model capable of transferring linguistic capabilities from English to DNA sequences. Using this model, we constructed a vocabulary of DNA words and mapped DNA words to their English equivalents.Subsequently, we fine-tuned this model using English datasets for paragraphing and sentence segmentation to develop models capable of segmenting DNA sequences into sentences and paragraphs. Leveraging these models, we processed the GRCh38.p14 human genome by segmenting, tokenizing, and organizing it into a ""book"" comprised of genomic ""words,"" ""sentences,"" and ""paragraphs."" Additionally, based on the DNA-to-English vocabulary mapping, we created an ""English version"" of the genomic book. This study offers a novel perspective for understanding the genome and provides exciting possibilities for developing innovative tools for DNA search, generation, and analysis.",Wang Liang,,2025-01-23T04:39:24Z,http://arxiv.org/abs/2501.16982v1
2503.16565v1,Gene42: Long-Range Genomic Foundation Model With Dense Attention,"We introduce Gene42, a novel family of Genomic Foundation Models (GFMs) designed to manage context lengths of up to 192,000 base pairs (bp) at a single-nucleotide resolution. Gene42 models utilize a decoder-only (LLaMA-style) architecture with a dense self-attention mechanism. Initially trained on fixed-length sequences of 4,096 bp, our models underwent continuous pretraining to extend the context length to 192,000 bp. This iterative extension allowed for the comprehensive processing of large-scale genomic data and the capture of intricate patterns and dependencies within the human genome. Gene42 is the first dense attention model capable of handling such extensive long context lengths in genomics, challenging state-space models that often rely on convolutional operators among other mechanisms. Our pretrained models exhibit notably low perplexity values and high reconstruction accuracy, highlighting their strong ability to model genomic data. Extensive experiments on various genomic benchmarks have demonstrated state-of-the-art performance across multiple tasks, including biotype classification, regulatory region identification, chromatin profiling prediction, variant pathogenicity prediction, and species classification. The models are publicly available at huggingface.co/inceptionai.",Kirill Vishniakov; Boulbaba Ben Amor; Engin Tekin; Nancy A. ElNaker; Karthik Viswanathan; Aleksandr Medvedev; Aahan Singh; Maryam Nadeem; Mohammad Amaan Sayeed; Praveenkumar Kanithi; Tiago Magalhaes; Natalia Vassilieva; Dwarikanath Mahapatra; Marco Pimentel; and Shadab Khan,,2025-03-20T07:10:04Z,http://arxiv.org/abs/2503.16565v1
2504.06304v2,Leveraging State Space Models in Long Range Genomics,"Long-range dependencies are critical for understanding genomic structure and function, yet most conventional methods struggle with them. Widely adopted transformer-based models, while excelling at short-context tasks, are limited by the attention module's quadratic computational complexity and inability to extrapolate to sequences longer than those seen in training. In this work, we explore State Space Models (SSMs) as a promising alternative by benchmarking two SSM-inspired architectures, Caduceus and Hawk, on long-range genomics modeling tasks under conditions parallel to a 50M parameter transformer baseline. We discover that SSMs match transformer performance and exhibit impressive zero-shot extrapolation across multiple tasks, handling contexts 10 to 100 times longer than those seen during training, indicating more generalizable representations better suited for modeling the long and complex human genome. Moreover, we demonstrate that these models can efficiently process sequences of 1M tokens on a single GPU, allowing for modeling entire genomic regions at once, even in labs with limited compute. Our findings establish SSMs as efficient and scalable for long-context genomic analysis.",Matvei Popov; Aymen Kallala; Anirudha Ramesh; Narimane Hennouni; Shivesh Khaitan; Rick Gentry; Alain-Sam Cohen,,2025-04-07T18:34:06Z,http://arxiv.org/abs/2504.06304v2
2506.19097v1,Quantum Gradient Optimized Drug Repurposing Prototype for Omics Data,This paper presents a novel quantum-enhanced prototype for drug repurposing and addresses the challenge of managing massive genomics data in precision medicine.,Don Roosan; Saif Nirzhor; Rubayat Khan; Fahmida Hai,,2025-06-23T20:17:55Z,http://arxiv.org/abs/2506.19097v1
2508.13191v1,NucEL: Single-Nucleotide ELECTRA-Style Genomic Pre-training for   Efficient and Interpretable Representations,"Pre-training large language models on genomic sequences is a powerful approach for learning biologically meaningful representations. Masked language modeling (MLM) methods, such as DNABERT and Nucleotide Transformer (NT), achieve strong performance but suffer from partial token supervision, pre-training/fine-tuning mismatches, and high computational costs. We introduce NucEL, the first ELECTRA-style pre-training framework for genomic foundation models, addressing these limitations. Using a discriminator to identify tokens altered by a generator, NucEL provides comprehensive token-level supervision across all sequence positions, improving efficiency over the partial supervision of MLM. Incorporating ModernBERT's hybrid local-global attention and flash attention, NucEL offers an optimized BERT architecture for genomic modeling. Unlike 6-mer tokenization, NucEL uses single-nucleotide tokens for fine-grained resolution, boosting both efficiency and interpretability. Pre-trained on the human genome, NucEL achieves state-of-the-art results on diverse downstream tasks -- regulatory element identification (e.g., promoters, enhancers), transcription factor binding prediction, open chromatin classification, and histone modification profiling -- surpassing similarly sized MLM-based models and rivaling models 25x larger, such as NT. Ablation studies highlight optimal tokenization and masking strategies for ELECTRA-style DNA pre-training. Attention analysis reveals NucEL's superior capture of biologically relevant motifs compared to NT, providing insights into hierarchical learning and regulatory element modeling. These findings demonstrate ELECTRA-style pre-training as an efficient, effective strategy for genomic representation learning with broad implications for genomic research.",Ke Ding; Brian Parker; Jiayu Wen,,2025-08-15T12:34:51Z,http://arxiv.org/abs/2508.13191v1
2502.15109v4,Social Genome: Grounded Social Reasoning Abilities of Multimodal Models,"Social reasoning abilities are crucial for AI systems to effectively interpret and respond to multimodal human communication and interaction within social contexts. We introduce SOCIAL GENOME, the first benchmark for fine-grained, grounded social reasoning abilities of multimodal models. SOCIAL GENOME contains 272 videos of interactions and 1,486 human-annotated reasoning traces related to inferences about these interactions. These traces contain 5,777 reasoning steps that reference evidence from visual cues, verbal cues, vocal cues, and external knowledge (contextual knowledge external to videos). SOCIAL GENOME is also the first modeling challenge to study external knowledge in social reasoning. SOCIAL GENOME computes metrics to holistically evaluate semantic and structural qualities of model-generated social reasoning traces. We demonstrate the utility of SOCIAL GENOME through experiments with state-of-the-art models, identifying performance gaps and opportunities for future research to improve the grounded social reasoning abilities of multimodal models.",Leena Mathur; Marian Qian; Paul Pu Liang; Louis-Philippe Morency,,2025-02-21T00:05:40Z,http://arxiv.org/abs/2502.15109v4
2503.20451v1,Agptools: a utility suite for editing genome assemblies,"The AGP format is a tab-separated table format describing how components of a genome assembly fit together. A standard submission format for genome assemblies is a fasta file giving the sequence of contigs along with an AGP file showing how these components are assembled into larger pieces like scaffolds or chromosomes. For this reason, many scaffolding software pipelines output assemblies in this format. However, although many programs for assembling and scaffolding genomes read and write this format, there is currently no published software for making edits to AGP files when performing assembly curation. We present agptools, a suite of command-line programs that can perform common operations on AGP files, such as breaking and joining sequences, inverting pieces of assembly components, assembling contigs into larger sequences based on an AGP file, and transforming between coordinate systems of different assembly layouts. Additionally, agptools includes an API that writers of other software packages can use to read, write, and manipulate AGP files within their own programs. Agptools gives bioinformaticians a simple, robust, and reproducible way to edit genome assemblies that avoids the shortfalls of other methods for editing AGP files.",Edward S. Ricemeyer; Rachel A. Carroll; Wesley C. Warren,,2025-03-26T11:26:21Z,http://arxiv.org/abs/2503.20451v1
2506.00082v1,An AI-powered Knowledge Hub for Potato Functional Genomics,"Potato functional genomics lags due to unsystematic gene information curation, gene identifier inconsistencies across reference genome versions, and the increasing volume of research publications. To address these limitations, we developed the Potato Knowledge Hub (http://www.potato-ai.top), leveraging Large Language Models (LLMs) and a systematically curated collection of over 3,200 high-quality potato research papers spanning over 120 years. This platform integrates two key modules: a functional gene database containing 2,571 literature-reported genes, meticulously mapped to the latest DMv8.1 reference genome with resolved nomenclature discrepancies and links to original publications; and a potato knowledge base. The knowledge base, built using a Retrieval-Augmented Generation (RAG) architecture, accurately answers research queries with literature citations, mitigating LLM ""hallucination."" Users can interact with the hub via a natural language AI agent, ""Potato Research Assistant,"" for querying specialized knowledge, retrieving gene information, and extracting sequences. The continuously updated Potato Knowledge Hub aims to be a comprehensive resource, fostering advancements in potato functional genomics and supporting breeding programs.",Jia Yuxin; Li Jinye; Jia Yudong; Li Futing; Su Xiaoqi; Luo Jilin; Dong Yarui; Sun Chunyan; Cui Qinghan; Wang Li; Li Axiu; Shang Yi; Zhu Yujuan; Huang Sanwen,,2025-05-30T03:09:59Z,http://arxiv.org/abs/2506.00082v1
2506.00597v1,Processing-in-memory for genomics workloads,"Low-cost, high-throughput DNA and RNA sequencing (HTS) data is the main workforce for the life sciences. Genome sequencing is now becoming a part of Predictive, Preventive, Personalized, and Participatory (termed 'P4') medicine. All genomic data are currently processed in energy-hungry computer clusters and centers, necessitating data transfer, consuming substantial energy, and wasting valuable time. Therefore, there is a need for fast, energy-efficient, and cost-efficient technologies that enable genomics research without requiring data centers and cloud platforms. We recently started the BioPIM Project to leverage the emerging processing-in-memory (PIM) technologies to enable energy and cost-efficient analysis of bioinformatics workloads. The BioPIM Project focuses on co-designing algorithms and data structures commonly used in genomics with several PIM architectures for the highest cost, energy, and time savings benefit.",William Andrew Simon; Leonid Yavits; Konstantina Koliogeorgi; Yann Falevoz; Yoshihiro Shibuya; Dominique Lavenier; Irem Boybat; Klea Zambaku; Berkan Şahin; Mohammad Sadrosadati; Onur Mutlu; Abu Sebastian; Rayan Chikhi; The BioPIM Consortium; Can Alkan,,2025-05-31T15:13:06Z,http://arxiv.org/abs/2506.00597v1
2506.19324v1,Memory-Augmented Incomplete Multimodal Survival Prediction via   Cross-Slide and Gene-Attentive Hypergraph Learning,"Multimodal pathology-genomic analysis is critical for cancer survival prediction. However, existing approaches predominantly integrate formalin-fixed paraffin-embedded (FFPE) slides with genomic data, while neglecting the availability of other preservation slides, such as Fresh Froze (FF) slides. Moreover, as the high-resolution spatial nature of pathology data tends to dominate the cross-modality fusion process, it hinders effective multimodal fusion and leads to modality imbalance challenges between pathology and genomics. These methods also typically require complete data modalities, limiting their clinical applicability with incomplete modalities, such as missing either pathology or genomic data. In this paper, we propose a multimodal survival prediction framework that leverages hypergraph learning to effectively integrate multi-WSI information and cross-modality interactions between pathology slides and genomics data while addressing modality imbalance. In addition, we introduce a memory mechanism that stores previously learned paired pathology-genomic features and dynamically compensates for incomplete modalities. Experiments on five TCGA datasets demonstrate that our model outperforms advanced methods by over 2.3% in C-Index. Under incomplete modality scenarios, our approach surpasses pathology-only (3.3%) and gene-only models (7.9%). Code: https://github.com/MCPathology/M2Surv",Mingcheng Qu; Guang Yang; Donglin Di; Yue Gao; Tonghua Su; Yang Song; Lei Fan,,2025-06-24T05:31:13Z,http://arxiv.org/abs/2506.19324v1
2507.11950v1,RNAMunin: A Deep Machine Learning Model for Non-coding RNA Discovery,"Functional annotation of microbial genomes is often biased toward protein-coding genes, leaving a vast, unexplored landscape of non-coding RNAs (ncRNAs) that are critical for regulating bacterial and archaeal physiology, stress response and metabolism. Identifying ncRNAs directly from genomic sequence is a paramount challenge in bioinformatics and biology, essential for understanding the complete regulatory potential of an organism. This paper presents RNAMunin, a machine learning (ML) model that is capable of finding ncRNAs using genomic sequence alone. It is also computationally viable for large sequence datasets such as long read metagenomic assemblies with contigs totaling multiple Gbp. RNAMunin is trained on Rfam sequences extracted from approximately 60 Gbp of long read metagenomes from 16 San Francisco Estuary samples. We know of no other model that can detect ncRNAs based solely on genomic sequence at this scale. Since RNAMunin only requires genomic sequence as input, we do not need for an ncRNA to be transcribed to find it, i.e., we do not need transcriptomics data. We wrote this manuscript in a narrative style in order to best convey how RNAMunin was developed and how it works in detail. Unlike almost all current ML models, at approximately 1M parameters, RNAMunin is very small and very fast.",Lauren Lui; Torben Nielsen,,2025-07-16T06:33:50Z,http://arxiv.org/abs/2507.11950v1
2508.09406v1,CAKL: Commutative algebra k-mer learning of genomics,"Despite the availability of various sequence analysis models, comparative genomic analysis remains a challenge in genomics, genetics, and phylogenetics. Commutative algebra, a fundamental tool in algebraic geometry and number theory, has rarely been used in data and biological sciences. In this study, we introduce commutative algebra k-mer learning (CAKL) as the first-ever nonlinear algebraic framework for analyzing genomic sequences. CAKL bridges between commutative algebra, algebraic topology, combinatorics, and machine learning to establish a new mathematical paradigm for comparative genomic analysis. We evaluate its effectiveness on three tasks -- genetic variant identification, phylogenetic tree analysis, and viral genome classification -- typically requiring alignment-based, alignment-free, and machine-learning approaches, respectively. Across eleven datasets, CAKL outperforms five state-of-the-art sequence analysis methods, particularly in viral classification, and maintains stable predictive accuracy as dataset size increases, underscoring its scalability and robustness. This work ushers in a new era in commutative algebraic data analysis and learning.",Faisal Suwayyid; Yuta Hozumi; Hongsong Feng; Mushal Zia; JunJie Wee; Guo-Wei Wei,,2025-08-13T00:43:32Z,http://arxiv.org/abs/2508.09406v1
2501.02284v3,"Origin of $α$-satellite repeat arrays from mitochondrial molecular   fossils -- sequential insertion, expansion, and evolution in the nuclear   genome","Alpha satellite DNA is large tandem arrays of 150-400 bp units, and its origin remains an evolutionary mystery. In this research, we identified 1,545 alpha-satellite-like (SatL) repeat units in the nuclear genome of jewel wasp Nasonia vitripennis. Among them, thirty-nine copies of SatL were organized in two palindromic arrays in mitochondria, resulting in a 50% increase in the genome size. Strikingly, genomic neighborhood analyses of 1,516 nuclear SatL repeats revealed that they are located in NuMT (nuclear mitochondrial DNA) regions, and SatL phylogeny matched perfectly with mitochondrial genes and NuMT pseudogenes. These results support that SatL arrays originated from ten independent mitochondria insertion events into the nuclear genome within the last 500,000 years, after divergence from its sister species N. giraulti. Dramatic repeat GC-percent elevation (from 33.9% to 50.4%) is a hallmark of rapid SatL sequence evolution in mitochondria due to GC-biased gene conversion facilitated by the palindromic sequence pairing of the two mitochondrial SatL arrays. The nuclear SatL repeat arrays underwent substantial copy number expansion, from 12-15 (SatL1) to over 400 copies (SatL4). The oldest SatL4B array consists of four types of repeat units derived from deletions in the AT-rich region of ancestral repeats, and complex high-order structures have evolved through duplications. We also discovered similar repeat insertions into the nuclear genome of Muscidifurax, suggesting this mechanism can be common in insects. This is the first report of the mitochondrial origin of nuclear satellite sequences, and our findings shed new light on the origin and evolution of satellite DNA.",Yihang Zhou,,2025-01-04T13:22:30Z,http://arxiv.org/abs/2501.02284v3
