ARXIVID,Title,Abstract,Authors,Affiliations,Date_published,URL
2509.06234v1,Minimum-Cost Synthetic Genome Planning: An Algorithmic Framework,"As synthetic genomics scales toward the construction of increasingly larger genomes, computational strategies are needed to address technical feasibility. We introduce an algorithmic framework for the Minimum-Cost Synthetic Genome Planning problem, aiming to identify the most cost-effective strategy to assemble a target genome from a source genome through a combination of reuse, synthesis, and join operations. By comparing dynamic programming and greedy heuristic strategies under diverse cost regimes, we demonstrate how algorithmic choices influence the cost-efficiency of large-scale genome construction. In parallel, solving the Minimum-Cost Synthetic Genome Planning problem can help us better understand genome architecture and evolution. We applied our framework in case studies on viral genomes, including SARS-CoV-2, to examine how source-target genome similarity shapes construction costs. Our analyses revealed that conserved regions such as ORF1ab can be reconstructed cost-effectively from related templates, while highly variable regions such as the S (spike) gene are more reliant on DNA synthesis, highlighting the biological and economic trade-offs of genome design.",Michail Patsakis; Ioannis Mouratidis; Ilias Georgakopoulos-Soares,,2025-09-07T22:46:57Z,http://arxiv.org/abs/2509.06234v1
2505.08918v1,When repeats drive the vocabulary: a Byte-Pair Encoding analysis of T2T   primate genomes,"The emergence of telomere-to-telomere (T2T) genome assemblies has opened new avenues for comparative genomics, yet effective tokenization strategies for genomic sequences remain underexplored. In this pilot study, we apply Byte Pair Encoding (BPE) to nine T2T primate genomes including three human assemblies by training independent BPE tokenizers with a fixed vocabulary of 512,000 tokens using our custom tool, dnaBPE. Our analysis reveals that only 11,569 tokens are shared across all assemblies, while nearly 991,854 tokens are unique to a single genome, indicating a rapid decline in shared vocabulary with increasing assembly comparisons. Moreover, phylogenetic trees derived from token overlap failed to recapitulate established primate relationships, a discrepancy attributed to the disproportionate influence of species-specific high-copy repetitive elements. These findings underscore the dual nature of BPE tokenization: while it effectively compresses repetitive sequences, its sensitivity to high-copy elements limits its utility as a universal tool for comparative genomics. We discuss potential hybrid strategies and repeat-masking approaches to refine genomic tokenization, emphasizing the need for domain-specific adaptations in the development of large-scale genomic language models. The dnaBPE tool used in this study is open-source and available at https://github.com/aglabx/dnaBPE.",Marina Popova; Iaroslav Chelombitko; Aleksey Komissarov,,2025-05-13T19:27:58Z,http://arxiv.org/abs/2505.08918v1
2505.16680v1,Learning Genomic Structure from $k$-mers,"Sequencing a genome to determine an individual's DNA produces an enormous number of short nucleotide subsequences known as reads, which must be reassembled to reconstruct the full genome. We present a method for analyzing this type of data using contrastive learning, in which an encoder model is trained to produce embeddings that cluster together sequences from the same genomic region. The sequential nature of genomic regions is preserved in the form of trajectories through this embedding space. Trained solely to reflect the structure of the genome, the resulting model provides a general representation of $k$-mer sequences, suitable for a range of downstream tasks involving read data. We apply our framework to learn the structure of the $E.\ coli$ genome, and demonstrate its use in simulated ancient DNA (aDNA) read mapping and identification of structural variations. Furthermore, we illustrate the potential of using this type of model for metagenomic species identification. We show how incorporating a domain-specific noise model can enhance embedding robustness, and how a supervised contrastive learning setting can be adopted when a linear reference genome is available, by introducing a distance thresholding parameter $\Gamma$. The model can also be trained fully self-supervised on read data, enabling analysis without the need to construct a full genome assembly using specialized algorithms. Small prediction heads based on a pre-trained embedding are shown to perform on par with BWA-aln, the current gold standard approach for aDNA mapping, in terms of accuracy and runtime for short genomes. Given the method's favorable scaling properties with respect to total genome size, inference using our approach is highly promising for metagenomic applications and for mapping to genomes comparable in size to the human genome.",Filip Thor; Carl Nettelblad,,2025-05-22T13:46:18Z,http://arxiv.org/abs/2505.16680v1
2504.17860v1,"An Integrated Genomics Workflow Tool: Simulating Reads, Evaluating Read   Alignments, and Optimizing Variant Calling Algorithms","Next-generation sequencing (NGS) is a pivotal technique in genome sequencing due to its high throughput, rapid results, cost-effectiveness, and enhanced accuracy. Its significance extends across various domains, playing a crucial role in identifying genetic variations and exploring genomic complexity. NGS finds applications in diverse fields such as clinical genomics, comparative genomics, functional genomics, and metagenomics, contributing substantially to advancements in research, medicine, and scientific disciplines. Within the sphere of genomics data science, the execution of read simulation, mapping, and variant calling holds paramount importance for obtaining precise and dependable results. Given the plethora of tools available for these purposes, each employing distinct methodologies and options, a nuanced understanding of their intricacies becomes imperative for optimization. This research, situated at the intersection of data science and genomics, involves a meticulous assessment of various tools, elucidating their individual strengths and weaknesses through rigorous experimentation and analysis. This comprehensive evaluation has enabled the researchers to pinpoint the most accurate tools, reinforcing the alignment between the established workflow and the demonstrated efficacy of specific tools in the context of genomics data analysis. To meet these requirements, ""VarFind"", an open-source and freely accessible pipeline tool designed to automate the entire process has been introduced (VarFind GitHub repository: https://github.com/shanikawm/varfinder)",Fathima Nuzla Ismail; Shanika Amarasoma,,2025-04-24T18:05:08Z,http://arxiv.org/abs/2504.17860v1
2502.21125v1,Eukaryotes evade information storage-replication rate trade-off with   endosymbiont assistance leading to larger genomes,"Genome length varies widely among organisms, from compact genomes of prokaryotes to vast and complex genomes of eukaryotes. In this study, we theoretically identify the evolutionary pressures that may have driven this divergence in genome length. We use a parameter-free model to study genome length evolution under selection pressure to minimize replication time and maximize information storage capacity. We show that prokaryotes tend to reduce genome length, constrained by a single replication origin, while eukaryotes expand their genomes by incorporating multiple replication origins. We propose a connection between genome length and cellular energetics, suggesting that endosymbiotic organelles, mitochondria and chloroplasts, evolutionarily regulate the number of replication origins, thereby influencing genome length in eukaryotes. We show that the above two selection pressures also lead to strict equalization of the number of purines and their corresponding base-pairing pyrimidines within a single DNA strand, known as Chagraff's second parity rule, a hitherto unexplained observation in genomes of nearly all known species. This arises from the symmetrization of replichore length, another observation that has been shown to hold across species, which our model reproduces. The model also reproduces other experimentally observed phenomena, such as a general preference for deletions over insertions, and elongation and high variance of genome lengths under reduced selection pressure for replication rate, termed the C-value paradox. We highlight the possibility of regulation of the firing of latent replication origins in response to cues from the extracellular environment leading to the regulation of cell cycle rates in multicellular eukaryotes.",Parthasarathi Sahu; Sashikanta Barik; Koushik Ghosh; Hemachander Subramanian,,2025-02-28T15:01:36Z,http://arxiv.org/abs/2502.21125v1
2504.09060v1,Multimodal 3D Genome Pre-training,"Deep learning techniques have driven significant progress in various analytical tasks within 3D genomics in computational biology. However, a holistic understanding of 3D genomics knowledge remains underexplored. Here, we propose MIX-HIC, the first multimodal foundation model of 3D genome that integrates both 3D genome structure and epigenomic tracks, which obtains unified and comprehensive semantics. For accurate heterogeneous semantic fusion, we design the cross-modal interaction and mapping blocks for robust unified representation, yielding the accurate aggregation of 3D genome knowledge. Besides, we introduce the first large-scale dataset comprising over 1 million pairwise samples of Hi-C contact maps and epigenomic tracks for high-quality pre-training, enabling the exploration of functional implications in 3D genomics. Extensive experiments show that MIX-HIC can significantly surpass existing state-of-the-art methods in diverse downstream tasks. This work provides a valuable resource for advancing 3D genomics research.",Minghao Yang; Pengteng Li; Yan Liang; Qianyi Cai; Zhihang Zheng; Shichen Zhang; Pengfei Zhang; Zhi-An Huang; Hui Xiong,,2025-04-12T03:31:03Z,http://arxiv.org/abs/2504.09060v1
2505.07919v1,Revolutionising Bacterial Genomics: Graph-Based Strategies for Improved   Variant Identification,"A significant advancement in bioinformatics is using genome graph techniques to improve variation discovery across organisms. Traditional approaches, such as bwa mem, rely on linear reference genomes for genomic analyses but may introduce biases when applied to highly diverse bacterial genomes of the same species. Pangenome graphs provide an alternative paradigm for evaluating structural and minor variations within a graphical framework, including insertions, deletions, and single nucleotide polymorphisms. Pangenome graphs enhance the detection and interpretation of complex genetic variants by representing the full genetic diversity of a species. In this study, we present a robust and reliable bioinformatics pipeline utilising the PanGenome Graph Builder (PGGB) and the Variation Graph toolbox (vg giraffe) to align whole-genome sequencing data, call variants against a graph reference, and construct pangenomes from assembled genomes. Our results demonstrate that leveraging pangenome graphs over a single linear reference genome significantly improves mapping rates and variant calling accuracy for simulated and actual bacterial pathogens datasets.",Fathima Nuzla Ismail; Abira Sengupta,,2025-05-12T15:34:24Z,http://arxiv.org/abs/2505.07919v1
2505.14402v1,OmniGenBench: A Modular Platform for Reproducible Genomic Foundation   Models Benchmarking,"The code of nature, embedded in DNA and RNA genomes since the origin of life, holds immense potential to impact both humans and ecosystems through genome modeling. Genomic Foundation Models (GFMs) have emerged as a transformative approach to decoding the genome. As GFMs scale up and reshape the landscape of AI-driven genomics, the field faces an urgent need for rigorous and reproducible evaluation. We present OmniGenBench, a modular benchmarking platform designed to unify the data, model, benchmarking, and interpretability layers across GFMs. OmniGenBench enables standardized, one-command evaluation of any GFM across five benchmark suites, with seamless integration of over 31 open-source models. Through automated pipelines and community-extensible features, the platform addresses critical reproducibility challenges, including data transparency, model interoperability, benchmark fragmentation, and black-box interpretability. OmniGenBench aims to serve as foundational infrastructure for reproducible genomic AI research, accelerating trustworthy discovery and collaborative innovation in the era of genome-scale modeling.",Heng Yang; Jack Cole; Yuan Li; Renzhi Chen; Geyong Min; Ke Li,,2025-05-20T14:16:25Z,http://arxiv.org/abs/2505.14402v1
2503.19367v3,VGAT: A Cancer Survival Analysis Framework Transitioning from Generative   Visual Question Answering to Genomic Reconstruction,"Multimodal learning combining pathology images and genomic sequences enhances cancer survival analysis but faces clinical implementation barriers due to limited access to genomic sequencing in under-resourced regions. To enable survival prediction using only whole-slide images (WSI), we propose the Visual-Genomic Answering-Guided Transformer (VGAT), a framework integrating Visual Question Answering (VQA) techniques for genomic modality reconstruction. By adapting VQA's text feature extraction approach, we derive stable genomic representations that circumvent dimensionality challenges in raw genomic data. Simultaneously, a cluster-based visual prompt module selectively enhances discriminative WSI patches, addressing noise from unfiltered image regions. Evaluated across five TCGA datasets, VGAT outperforms existing WSI-only methods, demonstrating the viability of genomic-informed inference without sequencing. This approach bridges multimodal research and clinical feasibility in resource-constrained settings. The code link is https://github.com/CZZZZZZZZZZZZZZZZZ/VGAT.",Zizhi Chen; Minghao Han; Xukun Zhang; Shuwei Ma; Tao Liu; Xing Wei; Lihua Zhang,,2025-03-25T05:48:31Z,http://arxiv.org/abs/2503.19367v3
2503.23691v1,A Conceptual Framework for Human-AI Collaborative Genome Annotation,"Genome annotation is essential for understanding the functional elements within genomes. While automated methods are indispensable for processing large-scale genomic data, they often face challenges in accurately predicting gene structures and functions. Consequently, manual curation by domain experts remains crucial for validating and refining these predictions. These combined outcomes from automated tools and manual curation highlight the importance of integrating human expertise with AI capabilities to improve both the accuracy and efficiency of genome annotation. However, the manual curation process is inherently labor-intensive and time-consuming, making it difficult to scale for large datasets. To address these challenges, we propose a conceptual framework, Human-AI Collaborative Genome Annotation (HAICoGA), which leverages the synergistic partnership between humans and artificial intelligence to enhance human capabilities and accelerate the genome annotation process. Additionally, we explore the potential of integrating Large Language Models (LLMs) into this framework to support and augment specific tasks. Finally, we discuss emerging challenges and outline open research questions to guide further exploration in this area.",Xiaomei Li; Alex Whan; Meredith McNeil; David Starns; Jessica Irons; Samuel C. Andrew; Rad Suchecki,,2025-03-31T03:44:00Z,http://arxiv.org/abs/2503.23691v1
2503.03773v1,A Phylogenetic Approach to Genomic Language Modeling,"Genomic language models (gLMs) have shown mostly modest success in identifying evolutionarily constrained elements in mammalian genomes. To address this issue, we introduce a novel framework for training gLMs that explicitly models nucleotide evolution on phylogenetic trees using multispecies whole-genome alignments. Our approach integrates an alignment into the loss function during training but does not require it for making predictions, thereby enhancing the model's applicability. We applied this framework to train PhyloGPN, a model that excels at predicting functionally disruptive variants from a single sequence alone and demonstrates strong transfer learning capabilities.",Carlos Albors; Jianan Canal Li; Gonzalo Benegas; Chengzhong Ye; Yun S. Song,,2025-03-04T06:53:03Z,http://arxiv.org/abs/2503.03773v1
2509.05539v1,Investigating DNA words and their distributions across the tree of life,"The frequency distributions of DNA k-mers are shaped by fundamental biological processes and offer a window into genome structure and evolution. Inspired by analogies to natural language, prior studies have attempted to model genomic k-mer usage using Zipf's law, a rank-frequency law originally formulated for words in human language. However, the extent to which this law accurately captures the distribution of k-mers across diverse species remains unclear. Here, we systematically analyze k-mer frequency spectra across more than 225,000 genome assemblies spanning all three domains of life and viruses. We demonstrate that Zipf's law consistently underperforms in modeling k-mer distributions. In contrast, we propose the truncated power law and Zipf-Mandelbrot distributions, which provide substantially improved fits across taxonomic groups. We show that genome size and GC content influence model performance, with larger and GC-content imbalanced genomes yielding better adherence. Additionally, we perform an extensive analysis on vocabulary expansion and exhaustion across the same organisms using Heaps' law. We apply our modeling framework to evaluate simulated genomes generated by k-let preserving shuffling and deep generative language models. Our results reveal substantial differences between organismal genomes and their synthetic or shuffled counterparts, offering a novel approach to benchmark the biological plausibility of artificial genomes. Collectively, this work establishes new standards for modeling genomic k-mer distributions and provides insights relevant to synthetic biology, and evolutionary sequence analysis.",Charalampos Koilakos; Kimonas Provatas; Michail Patsakis; Aris Karatzikos; Ilias Georgakopoulos-Soares,,2025-09-05T23:32:30Z,http://arxiv.org/abs/2509.05539v1
2501.11982v1,WinPCA: A package for windowed principal component analysis,"Principal component analysis (PCA) is routinely used in population genetics to assess genetic structure. With chromosomal reference genomes and population-scale whole genome-sequencing becoming increasingly accessible, contemporary studies often include characterizations of the genomic landscape as it varies along chromosomes, commonly termed genome scans. While traditional summary statistics like FST and dXY remain integral to characterizing the genomic divergence profile, PCA fundamentally differs by providing single-sample resolution, thereby making results intuitively interpretable to help identify polymorphic inversions, introgression and other types of divergent sequence. Here, we introduce WinPCA, a user-friendly package to compute, polarize and visualize genetic principal components in windows along the genome. To accommodate low-coverage whole genome-sequencing datasets, WinPCA can optionally make use of PCAngsd methods to compute principal components in a genotype likelihood framework. WinPCA accepts variant data in either VCF or BEAGLE format and can generate rich plots for interactive data exploration and downstream presentation.",L. Moritz Blumer; Jeffrey M. Good; Richard Durbin,,2025-01-21T08:57:45Z,http://arxiv.org/abs/2501.11982v1
2502.16470v1,Bancroft: Genomics Acceleration Beyond On-Device Memory,"This paper presents Bancroft, a computational genomics acceleration platform that provides the illusion of practically infinite on-device memory capacity by compressing genomic data movement over PCIe. Bancroft introduces novel optimizations for efficient accelerator implementation to reference-based genome compression, including fixed-stride matching using cuckoo hashes and grouped header encoding, incorporated into a familiar interface supporting random accesses. We evaluate a prototype implementation of Bancroft on an affordable Alveo U50 FPGA equipped with 8 GB of HBM. Thanks to the orders of magnitude improvements in performance and resource efficiency of genomic compression, our prototype provides access to TBs of host-side genomic data at memory-class performance, measuring speeds over 30% of the on-device HBM bandwidth, an order of magnitude higher than conventional PCIe-limited architectures. Using a real-world pre-alignment filtering application, Bancroft demonstrates over 6x improvement over the conventional PCIe-attached architecture, achieving 30% of peak internal throughput of an accelerator with HBM, and 90% of the one with DDR4. Bancroft supports memory-class performance to practically infinite data capacity, using a small, fixed amount of HBM, making it an attractive solution to continued future scalability of computational genomics.",Se-Min Lim; Seongyoung Kang; Sang-Woo Jun,,2025-02-23T07:07:09Z,http://arxiv.org/abs/2502.16470v1
2504.20034v1,Pan-genome Analysis of Angiosperm Plastomes using PGR-TK,"We present a novel approach for taxonomic analysis of chloroplast genomes in angiosperms using the Pan-genome Research Toolkit (PGR-TK). Comparative plots generated by PGR-TK across diverse angiosperm genera reveal a wide range of structural complexity, from straightforward to highly intricate patterns. Notably, the characteristic quadripartite plastome structure, comprising the large single copy (LSC), small single copy (SSC), and inverted repeat (IR) regions, is clearly identifiable in over 75% of the genera analyzed. Our findings also underscore several occurrences of species mis-annotations in public genomic databases, which are readily detected through visual anomalies in the PGR-TK plots. While more complex plot patterns remain difficult to interpret, they likely reflect underlying biological variation or technical inconsistencies in genome assembly. Overall, this approach effectively integrates classical botanical visualization with modern molecular taxonomy, providing a powerful tool for genome-based classification in plant systematics.",Manoj P. Samanta,,2025-04-28T17:56:13Z,http://arxiv.org/abs/2504.20034v1
2506.01833v1,SPACE: Your Genomic Profile Predictor is a Powerful DNA Foundation Model,"Inspired by the success of unsupervised pre-training paradigms, researchers have applied these approaches to DNA pre-training. However, we argue that these approaches alone yield suboptimal results because pure DNA sequences lack sufficient information, since their functions are regulated by genomic profiles like chromatin accessibility. Here, we demonstrate that supervised training for genomic profile prediction serves as a more effective alternative to pure sequence pre-training. Furthermore, considering the multi-species and multi-profile nature of genomic profile prediction, we introduce our $\textbf{S}$pecies-$\textbf{P}$rofile $\textbf{A}$daptive $\textbf{C}$ollaborative $\textbf{E}$xperts (SPACE) that leverages Mixture of Experts (MoE) to better capture the relationships between DNA sequences across different species and genomic profiles, thereby learning more effective DNA representations. Through extensive experiments across various tasks, our model achieves state-of-the-art performance, establishing that DNA models trained with supervised genomic profiles serve as powerful DNA representation learners. The code is available at https://github.com/ZhuJiwei111/SPACE.",Zhao Yang; Jiwei Zhu; Bing Su,,2025-06-02T16:23:05Z,http://arxiv.org/abs/2506.01833v1
2507.02877v1,AuraGenome: An LLM-Powered Framework for On-the-Fly Reusable and   Scalable Circular Genome Visualizations,"Circular genome visualizations are essential for exploring structural variants and gene regulation. However, existing tools often require complex scripting and manual configuration, making the process time-consuming, error-prone, and difficult to learn. To address these challenges, we introduce AuraGenome, an LLM-powered framework for rapid, reusable, and scalable generation of multi-layered circular genome visualizations. AuraGenome combines a semantic-driven multi-agent workflow with an interactive visual analytics system. The workflow employs seven specialized LLM-driven agents, each assigned distinct roles such as intent recognition, layout planning, and code generation, to transform raw genomic data into tailored visualizations. The system supports multiple coordinated views tailored for genomic data, offering ring, radial, and chord-based layouts to represent multi-layered circular genome visualizations. In addition to enabling interactions and configuration reuse, the system supports real-time refinement and high-quality report export. We validate its effectiveness through two case studies and a comprehensive user study. AuraGenome is available at: https://github.com/Darius18/AuraGenome.",Chi Zhang; Yu Dong; Yang Wang; Yuetong Han; Guihua Shan; Bixia Tang,,2025-06-18T03:29:30Z,http://arxiv.org/abs/2507.02877v1
